{"Outages":[{"OutageId":29280,"RegionId":460,"Region":"Weyburn East - Halbrite Griffin","Planned":"Unplanned","Alerts":[{"CreateDate":"Jul 27 10:27","Message":"A planned outage is scheduled on 7/29/26 from 11:00am to 1:00pm affecting customers North of Halbrite. "}]},{"OutageId":29281,"RegionId":16,"Region":"Candle Lake - Meath Park","Planned":"Planned","Alerts":[{"CreateDate":"Jul 27 12:35","Message":"A planned outage is scheduled on 7/29 from 10:00am to 16:00pm affecting customers in Meath Park - on the south side of town. "}]},{"OutageId":29279,"RegionId":27,"Region":"Carlyle - Frobisher Alameda","Planned":"Planned","Alerts":[{"CreateDate":"Jul 27 09:16","Message":"A planned outage is scheduled on 7/30/26 from 10:00am to 2:00pm affecting customers on 3rd St and 4th St in Alameda. "}]},{"OutageId":29278,"RegionId":86,"Region":"Kipling - Montmartre Kendal","Planned":"Planned","Alerts":[{"CreateDate":"Jul 27 08:48","Message":"A planned outage is scheduled on 7/30/26 from 10:00am to 12:00pm affecting customers South of Kendall."}]},{"OutageId":29277,"RegionId":471,"Region":"Weyburn West - Weyburn","Planned":"Planned","Alerts":[{"CreateDate":"Jul 27 08:43","Message":"Emergency repairs will result in an outage on 7/28/26 from 9:00AM to 12:00PM to repair damaged equipment affecting rural customers south of Weyburn and surrounding areas. "}]},{"OutageId":29235,"RegionId":46,"Region":"Estevan - Estevan","Planned":"Planned","Alerts":[{"CreateDate":"Jul 26 09:11","Message":"TIME CHANGE - A planned outage is scheduled on 7/26 from 7:00am to 11:00am affecting customers in Estevan - affecting customers on Escana St, Devonian St, Kensington Ave, Superior Ave, and Imperial Ave. ."},{"CreateDate":"Jul 23 12:19","Message":"A planned outage is scheduled on 7/26 from 7:00am to 10:00am affecting customers in Estevan - affecting customers on Escana St, Devonian St, Kensington Ave, Superior Ave, and Imperial Ave. ."}]},{"OutageId":29230,"RegionId":117,"Region":"Meadow Lake - Loon Lake","Planned":"Planned","Alerts":[{"CreateDate":"Jul 26 02:14","Message":"*CANCELLED* A planned outage is scheduled on 7/26 from 4:00am to 8:00am affecting customers in Loon Lake, Makwa Lake FN, Ministikwan FN, Mudie FN, Murphy Lake, Fowler Lake, Makwa Lake, Barthel , Whelan, and surrounding areas."},{"CreateDate":"Jul 23 10:14","Message":"A planned outage is scheduled on 7/26 from 4:00am to 8:00am affecting customers in Loon Lake, Makwa Lake FN, Ministikwan FN, Mudie FN, Murphy Lake, Fowler Lake, Makwa Lake, Barthel , Whelan, and surrounding areas."}]},{"OutageId":29258,"RegionId":226,"Region":"North Battleford Rural - Salteaux Meota","Planned":"Planned","Alerts":[{"CreateDate":"Jul 24 15:45","Message":"A planned outage is scheduled on 7/28 from 9:00am to 11:00am affecting customers in Moosomin FN, affecting customers along SK 769."}]},{"OutageId":29257,"RegionId":15,"Region":"Candle Lake - Christopher Lake","Planned":"Planned","Alerts":[{"CreateDate":"Jul 24 10:49","Message":"A planned outage is scheduled on7/28 from 10:00am to 2:00pm affecting customers in Okema Beach."}]},{"OutageId":29253,"RegionId":53,"Region":"Fort Qu\u0027Appelle - Fort Qu\u0027Appelle","Planned":"Planned","Alerts":[{"CreateDate":"Jul 24 07:58","Message":"A planned outage is scheduled on 7/28 from 9:30am to 4:30pm affecting customers south east of Fort Qu\u0027Appelle"}]},{"OutageId":29252,"RegionId":226,"Region":"North Battleford Rural - Salteaux Meota","Planned":"Planned","Alerts":[{"CreateDate":"Jul 24 07:40","Message":"A planned outage is scheduled on 7/28 from 6:00am to 9:00am affecting customers in Moosomin FN."}]},{"OutageId":29231,"RegionId":43,"Region":"Davidson - Outlook","Planned":"Planned","Alerts":[{"CreateDate":"Jul 23 10:16","Message":"A planned outage is scheduled on 7/27 from 1:00pm to 3:00pm affecting customers in Outlook - affecting customers on Christie St McGillivary St, Reid Cr."}]},{"OutageId":29218,"RegionId":118,"Region":"Meadow Lake - Meadow Lake","Planned":"Planned","Alerts":[{"CreateDate":"Jul 22 09:56","Message":"A planned outage is scheduled on 7/24 from 9:00am to 11:00am affecting customers south east of Meadow Lake near HWY#943. "}]}],"errorCode":0,"errorMessage":null,"errorDetails":null,"callId":null,"time":null}